{
  "run_id": "refused-scored",
  "created_at": "2026-10-12T09:00:00Z",
  "git_sha": "abc1234",
  "tier": "lite",
  "measured": true,
  "mock": false,
  "dataset": {
    "name": "RAGTruth",
    "subset": "qa",
    "split": "test",
    "n": 200,
    "revision": "c103204b9ce28d6bbad859304bf30de72b8ed8fe",
    "license_note": "RAGTruth (github.com/ParticleMedia/RAGTruth), MIT. Only metrics are published, never dataset text."
  },
  "systems": [
    {
      "id": "gate",
      "decision_model": {
        "backend": "openrouter-decisions",
        "snapshot": "typesafe/jev-1.13-20260917"
      },
      "judge": null,
      "metrics": {
        "precision": 0.71,
        "recall": 0.64,
        "f1": 0.67,
        "accuracy": 0.82,
        "balanced_accuracy": 0.77,
        "auroc": 0.85,
        "ece": 0.09,
        "brier": 0.13,
        "ci95": {
          "accuracy": [
            0.76,
            0.87
          ],
          "balanced_accuracy": [
            0.71,
            0.83
          ]
        }
      },
      "latency_ms": {
        "p50": 231,
        "p95": 512
      },
      "cost": {
        "usd_total": 0.0042,
        "usd_per_1k": 0.021,
        "cost_source": "reported"
      },
      "reliability": []
    },
    {
      "id": "llm_same_checks",
      "decision_model": null,
      "judge": {
        "provider": "openrouter",
        "model": "anthropic/claude-haiku-4.5"
      },
      "metrics": {
        "precision": 0.71,
        "recall": 0.64,
        "f1": 0.67,
        "accuracy": 0.82,
        "balanced_accuracy": 0.77,
        "auroc": 0.85,
        "ece": 0.09,
        "brier": 0.13,
        "ci95": {
          "accuracy": [
            0.76,
            0.87
          ],
          "balanced_accuracy": [
            0.71,
            0.83
          ]
        }
      },
      "latency_ms": {
        "p50": 1830,
        "p95": 3410
      },
      "cost": {
        "usd_total": 0.56,
        "usd_per_1k": 2.8,
        "cost_source": "reported"
      },
      "reliability": []
    }
  ],
  "errors": {
    "failed": 2,
    "excluded_over_budget": 0
  },
  "environment": {
    "region": "il",
    "concurrency": 4
  },
  "vendor": {
    "decision_host": "openrouter.ai",
    "judge_host": "openrouter.ai"
  },
  "inputs": {
    "dataset_revision": "c103204b9ce28d6bbad859304bf30de72b8ed8fe",
    "policy_source": "builtin",
    "gate_eval_sha256": "aaaaaaaaaaaaaaaaaaaaaaaaaaaaaaaaaaaaaaaaaaaaaaaaaaaaaaaaaaaaaaaa",
    "host_env": {
      "mem_available_mb": 3416,
      "loadavg": [
        0.52,
        0.61,
        0.7
      ],
      "platform": "WSL2",
      "region": "il"
    }
  },
  "quality": {
    "n": 400,
    "scored": 370,
    "failed": 2,
    "excluded": 28,
    "failure_rate": 0.005,
    "by_system": {
      "gate": {
        "n": 200,
        "scored": 199,
        "failed": 1,
        "excluded": 0
      },
      "llm_same_checks": {
        "n": 200,
        "scored": 199,
        "failed": 1,
        "excluded": 0
      }
    }
  },
  "dirty": false,
  "latency": {
    "connection": "warm",
    "gate_concurrency": 1
  }
}
